FundID,FundName,FundStyle,GeoMandate,Beta,AUM,AUM_Increase,pAlphaSrp_3yr
41569,ArrowMark Fundamental Opportunity Fund Ltd,Multi-Strategy,North America,0.131094496026139,534000000,1,3.03155798553953
41583,Ellington Credit Opportunities Fund Ltd,Fixed Income,Global,-0.0680135541271994,649000000,1,1.97663728234791
41593,Rimrock Structured Product Fund,Fixed Income,Global,0.0428923728057939,277000000,1,3.32315083777923
41630,GS Gamma Investments LLC,Fixed Income,North America,0.21094561294384,714000000,1,0.850037677117901
41726,AQR Multi-Strategy Alternative Fund - Class I,Multi-Strategy,Global,-0.247381429134513,2465999870,1,1.15124866684981
41727,AQR Multi-Strategy Alternative Fund - Class N,Multi-Strategy,Global,-0.244395404079614,2465999870,1,1.09103928429773
41742,AQR Style Premia Alternative Fund - Class I,Multi-Strategy,Global,-0.184133393895775,1804999940,1,0.838371497328964
41743,AQR Style Premia Alternative Fund - Class N,Multi-Strategy,Global,-0.185651891736603,1804999940,1,0.806552528362004
41760,BNY Mellon Absolute Return Bond Fund - Class I USD Hedged,Fixed Income,Global,0.0216142551224896,2356999940,1,0.786585259192405
41779,Athos Asia Event Driven Fund - Class A,Event Driven,Asia inc Japan,-0.0507000529395609,144000000,1,1.90566302113242
41815,Red Cliff Asia Fund - Class B USD,Relative Value,Asia inc Japan,-0.083507401409985,181000000,1,2.32092869579645
41861,STS Partners Fund Ltd,Fixed Income,Global,-0.00580373682106602,539000000,1,3.46395291440568
41897,Polygon European Equity Opportunity Master Fund,Event Driven,Europe,0.154645773246979,637000000,1,1.06777080301377
41899,Polygon Convertible Opportunity Master Fund - Class A,Relative Value,Global,0.127168881274968,418000000,1,2.10278566719803
41916,Helium Opportunities Part A - USD,Arbitrage,Global,0.0495549748551012,879000000,1,4.2888742487397
42027,Schroder GAIA Cat Bond - USD F Acc,Fixed Income,Global,-0.0465389146977185,771000000,1,1.8964107317477
42086,Schroder IF Core Insurance-Linked Securities Fund - I Share Class,Multi-Strategy,Global,-0.0184835205352699,289000000,1,3.19473967482504
42235,Pictet TR - Diversified Alpha HI USD,Multi-Strategy,Global,-0.0183551584265885,1120000000,1,0.804130536493129
42262,ASM Connaught House Fund LP,Distressed Debt,Asia inc Japan,0.186661087887866,127000000,1,2.25184981078517
42519,Argentiere Fund LP,Multi-Strategy,Global,-0.29019829508409,1820999940,1,0.881545065032991
42521,Argentiere Fund Ltd,Multi-Strategy,Global,-0.29019829508409,1820999940,1,0.881545065032991
