FundID,FundName,FundStyle,GeoMandate,Beta,AUM,AUM_Increase,pAlphaSrp_3yr
39066,Maestro Managed Futures Strategy Program,CTA/Managed Futures,Europe,-0.2247411078894,160000000,1,1.59481763689074
39073,Altum Credit Master Fund Ltd,Fixed Income,Global,0.086693637109105,395000000,1,2.4458646684363
39166,Abraham Trading Company Diversified Program,CTA/Managed Futures,North America,-0.0641261720630497,247000000,1,1.24467907497379
39221,Guggenheim Partners Opportunistic Investment Grade Securities Fund LLC,Fixed Income,North America,0.0362888120605043,2395000060,1,4.28690943724428
39261,Taiga Fund - USD Class,Long Short Equities,Europe,0.206823963274206,132000000,1,3.57295555759654
39283,Burgess Creek Fund LP,Fixed Income,North America,-0.0130623457553412,269000000,1,5.074787989344
39305,Macquarie European Alpha Fund - Class A USD,Long Short Equities,Europe,0.0734696267673856,677000000,1,1.74579231434954
39361,Acrospire Global Strategy,Long Short Equities,Global,0.00995399202768353,188000000,1,2.52090600488897
39422,III Relative Value Credit Strategies Fund Ltd - Series 2,Relative Value,Global,0.0605384175430139,139000000,1,2.87084133631543
39465,BlueBay Credit Opportunity Fund,Fixed Income,Global,0.0703712893210175,263000000,1,4.30200740658407
39491,Canosa Global Macro Fund Ltd - Class A,Macro,Global,0.170248829687237,846000000,1,0.897090617574144
39508,Axonic Credit Opportunities Master Fund,Fixed Income,North America,-0.0869575779760343,1960999940,1,3.38058427754595
39553,Tamarack Global Healthcare Offshore Fund Ltd,Long Short Equities,North America,0.141402761380142,240000000,1,1.6522951642468
39556,ArrowMark Fundamental Opportunity Fund LP,Multi-Strategy,North America,0.143473176666221,504000000,1,2.19199327580121
39580,Alken Absolute Return Europe - Class US1,Long Short Equities,Europe,0.177129059566193,2648000000,1,1.21991985982213
39600,III Credit Opportunities Fund LP - Series A,Relative Value,North America,0.0208381403289678,115000000,1,3.05151382619832
